{
  "name": "strata",
  "displayName": "Strata",
  "version": "1.0.0",
  "description": "Generational handoff runner: executes a long coding task as a chain of fresh Claude Code processes that pass a validated, compacted handoff forward, with independent verification of completion and crash-safe state.",
  "category": "autonomous",
  "license": "Apache-2.0",
  "maintainers": [
    {
      "name": "Belkis Aslani",
      "github": "BEKO2210",
      "role": "maintainer"
    }
  ],
  "tagline": "Every generation is a fresh context. Only a validated core sample crosses the boundary.",
  "banner": "assets/strata-banner.svg",
  "agents": [
    "claude-code"
  ],
  "highlights": [
    "Each generation is its own `claude -p` process — context never accumulates.",
    "Independent `--verify` commands overrule the agent's own completion claim.",
    "Atomic state: a killed host resumes from the last validated handoff.",
    "Stall detector, generation ceiling, turn cap and cost ceiling stop runaway loops."
  ],
  "quickstart": "cd skills/autonomous/strata && ./install.sh\n\nstrata start \"Fix the repository so lint and build pass without weakening checks.\" \\\n  --verify \"npm run lint\" \\\n  --verify \"npm run build\" \\\n  --max-generations 20 \\\n  --max-budget-usd 3",
  "homepage": "https://github.com/BEKO2210/SkillQuarry/tree/main/skills/autonomous/strata",
  "icon": "../../../assets/strata-logo.svg",
  "entrypoints": {
    "skill": "SKILL.md",
    "cli": "strata",
    "install": "install.sh",
    "uninstall": "uninstall.sh",
    "prefix_env": "STRATA_PREFIX"
  },
  "compatibility": [
    "claude-code"
  ],
  "platforms": [
    "linux",
    "macos"
  ],
  "requires": {
    "python": ">=3.10",
    "binaries": [
      "git",
      "claude"
    ],
    "packages": []
  },
  "permissions": {
    "filesystem": "read-write within the target git repository",
    "shell": "spawns `claude` and the user-supplied --verify commands",
    "network": "only indirectly, through Claude Code",
    "environment": "none read by the runner itself"
  },
  "state": {
    "directory": ".strata",
    "git": "registered in .git/info/exclude, .gitignore untouched"
  },
  "tests": {
    "command": "python3 tests/run_tests.py --min 100",
    "count": 100,
    "coverage": "100% of runner.py executable lines",
    "report": "TEST_REPORT.md"
  },
  "quality": "tested",
  "security": {
    "network_access": "indirect",
    "runs_external_commands": true,
    "writes_outside_repository": false,
    "requires_secrets": false,
    "destructive_operations": [],
    "threat_model": "TEST_REPORT.md",
    "reviewed_by": "Repository owner, 2026-08-13: live run against Claude Code 2.1.231, seven defects fixed before release."
  },
  "keywords": [
    "autonomous",
    "agent-loop",
    "ralph",
    "context-management",
    "handoff",
    "crash-recovery",
    "verification"
  ]
}
